,date_posted,playtime,review,helpful_funny,recommended
609,Posted: July 10,90.3 hrs on record,"Do not play this game, you play 10 hours of this and every other game will look ♥♥♥♥ in the future. Really hope Cyberpunk doesnt",No one has rated this review as helpful yet,Recommended
610,Posted: July 10,25.1 hrs on record,Truly compelling story. Excellent game play. We all love CD Projekt Red for making a game to enjoy not a game to milk cash. You will not be disappointed. Plenty of content I haven't even touched yet. You'll get tons of playtime out of this.,1 person found this review helpful,Recommended
611,Posted: July 10,56.2 hrs on record,good game,No one has rated this review as helpful yet,Recommended
612,Posted: July 10,64.8 hrs on record,"Great game, great story, must play!",No one has rated this review as helpful yet,Recommended
613,Posted: July 10,177.2 hrs on record,GOAT.,No one has rated this review as helpful yet,Recommended
614,Posted: July 10,43.2 hrs on record,One of the best game,No one has rated this review as helpful yet,Recommended
615,Posted: July 10,132.2 hrs on record,"One of the greatest games of I've ever played in my life.Amazing graphics.Voice acing is incredible.The story hands down is just fantastic.Long story but very much well worth it.Also side note, might be easier (not required) to understand everything if you play the previous two games, the game will still help bring you up to speed though.",1 person found this review helpful,Recommended
616,Posted: July 10,67.6 hrs on record,"playing this game feels like a chore, so many dumb meters to stare at during combat it makes the game feel more like a clicker, where you are just waiting for a meter to be done so you can press the button again. there are a lot unnecessary mechanics that make the ""game"" significantly less fun such as the wear, or how on harder difficulties health can really only be gained from eating. either you play on the two easy difficulties and you will breeze through anything with literally no trouble, which is just boring, or you play on the two hard difficulties, where it is almost impossible to play without grinding secondary missions and contracts for hours and hours. there is no real enemy scaling and there are many bottlenecks, where you physically can't advance past a certain point simply due to the difficulty of the level.these were all conscious decisions by the game creators and can be put down to taste (i personally don't enjoy wasting my time riding around killing useless enemies in order to progress but that's me), what is more unforgivable are the plethora of bugs that constantly ruin the gameplay. almost constantly i would find enemies levitating or teleporting in the air, only to divebomb me 3 times in a row (the griffin and the shrieker from early on specifically), which was impossible to dodge since they were teleporting. there is also the constant threat that geralt will get stuck on a ledge and is completely unable to move, forcing a reload of your save and completely halting any progress, resetting you back to a previous point. this happened to me 6 times in my first 10 hours of play, although ive been told by friends that these bugs are far less common than they are for me, so it may be that i am just unlucky.",No one has rated this review as helpful yet1 person found this review funny,Not Recommended
617,Posted: July 10,114.4 hrs on record,"This game is the best RPG ever made hands down, and a masterclass at story telling and character development. Think about what you would love an RPG to have and you will still be surprised. Plenty of side quests which tie into the world beautifully and do not get boring at all. In fact, the side quests don't feel like a chore as in other games that you have to do to level up or get interesting loot, you would feel like doing them because of how intricately crafted they are and what good stories they have to tell, which make the setting and the world so much more interesting. After all that you have the ""Hearts of stone"" expansion, easily one of the best stories told in a video game and then you have the expansion ""Blood and Wine"", which is just an entire game in its own right, under the guise of a DLC. The GOTY edittion is definitely the one to go for, it has both of the wonderful expansions for not much more compared to the base game. CDPR have certainly outdone themselves. Seriously, the hype for Cyberpunk 2077 is well founded. Throw your money at them guys, they definitely deserve it.",No one has rated this review as helpful yet,Recommended
618,Posted: July 10,88.4 hrs on record,"literally the best rpg games in the platform with a wonderful storylinebut it a bit sad after the endingyen, triss even ciri gone from the gameand geralt's friends just talk like a regular npc(like just saying ""yes, geralt?"")",No one has rated this review as helpful yet,Recommended
619,Posted: July 10,154.6 hrs on record,---{Graphics}---☑ You forget what reality is☐ Beautiful☐ Good☐ Decent☐ Bad☐ Don't look too long at it☐ Paint.exe---{Gameplay}---☑ 10 hours feels like 3 minutes☐ Very good☐ Good☐ It's just gameplay☐ Meh☐ Staring at walls is better☐ Just don't---{Audio}---☐ Eargasm☑ Very good☐ Good☐ Not too bad☐ Bad☐ Early 1990's TV static---{Audience}---☐ Kids☑ Teens☑ Adults☐ Human---{PC Requirements}---☐ Check if you can run paint☐ Potato☐ Decent☑ Fast☐ Rich boi☐ Ask NASA if they have a spare computer---{Difficulity}---☐ Just press 'A'☐ Easy☐ Significant brain usage☑ Easy to learn / hard to master☐ Difficult☐ Dark Souls---{Grind}---☐ Nothing to grind☐ Only if you care about leaderboards/ranks☐ Isn't necessary to progress☑ Average grind level☐ Too much grind☐ You'll need a second life for grinding---{Story}---☐ Story?☐ Text or audio floating around☐ Average☐ Good☐ Lovely☑ It'll replace your life---{Game Time}---☐ Long enough for a cup of coffee☐ Short☐ Average☑ Long ☑ To infinity and beyond (100%)---{Price}---☑ It's worth twice it's price☐ It's free!☐ Worth the price☐ If you have some spare money left☐ Not recommended☐ You could also just burn your money---{Bugs}---☐ Never heard of☑ Minor bugs ☐ Can get annoying☐ ARK: Survival Evolved☐ The game itself is a terrarium for bugs,No one has rated this review as helpful yet1 person found this review funny,Recommended
620,Posted: July 10,248.8 hrs on record,Best game of all time.,No one has rated this review as helpful yet,Recommended
621,Posted: July 10,187.4 hrs on record,yuhthis message brought to you by no-sign gang,No one has rated this review as helpful yet,Recommended
622,Posted: July 10,1.3 hrs on record,the best game ever,No one has rated this review as helpful yet,Recommended
623,Posted: July 10,25.9 hrs on record,This is the best game i have ever ♥♥♥♥ing played.,No one has rated this review as helpful yet,Recommended
624,Posted: July 10,362.6 hrs on record,Fantastic!,No one has rated this review as helpful yet,Recommended
625,Posted: July 10,79.9 hrs on record,"To all sale-buyers:DO NOT BUY THE VANILLA VERSION OF  THE GAME.I REPEAT.DO NOT BUY THE VANILLA VERSION OF THE GAME.ONLY BUY GOTY EDITION. It's worth an additional 30 hours (depending on your play style).Just think about it:Vanilla: 10$, GOTY: 14$4$ FOR 30 HOURS+ .GOD BLESS CDPR.ACTUALLY YOU KNOW WHAT, GO BUY THE VANILLA VERSION AND BUY ALL DLC SEPARATELY DURING NO-DISCOUNT SO YOU CAN SUPPORT CDPR.Good luck on the Path.",No one has rated this review as helpful yet,Recommended
626,Posted: July 10,123.0 hrs on record,:),No one has rated this review as helpful yet,Recommended
627,Posted: July 10,27.0 hrs on record,"I bought this on Xbox One when it was on sale (Didn't own pc then), Played about 50 or more hours, Then it went on sale on steam once i had a pc, I love the game so much i was willing to start from the beginning to experience this game at 60fps on High settings and take the story slow and i DO NOT regret it, If you haven't experienced this game PUT ALL OTHERS DOWN and get to this one!BEST GAME EVER!!!!Strong 11/10 from me",No one has rated this review as helpful yet,Recommended
628,Posted: July 10,89.3 hrs on record,Great game.,No one has rated this review as helpful yet,Recommended
629,Posted: July 10,317.0 hrs on record,i just love it,No one has rated this review as helpful yet,Recommended
630,Posted: July 10,119.5 hrs on record,"Product received for free
 Perfect, ♥♥♥♥♥♥♥♥!",No one has rated this review as helpful yet,Recommended
631,Posted: July 10,219.1 hrs on record,"This game is Legendary. An epic conclusion of the journey of Geralt of Rivia. I don't need to say anything. This game has it's own reputation. Not only GOTY can also count as the game of the decades or even century.  Optimization is damn so good.  If you haven't played Witcher 1 and 2 then don't play 3. You must finish 1 and 2 first then play wild hunt or else you won't understand a thing. The story varies on your choices. Your choice will lead to different endings. So craft your own path as you seem fit. Background music is damn awesome. If you are thinking to buy this then don't waste your time by thinking BUY ITEven if you buy this game with it's full price you won't regret. It's totally worthy. So far so good...will give a full review when finished the game 100%  FINALLY  After 217Hours of gameplay finished the game 100%, did every side quest, discovered every location, got every grandmaster armor. A GOOD CONCLUSION OF THE WITCHER SERIES IT WILL REMAIN A LEGEND FORVEVER",1 person found this review helpful,Recommended
632,Posted: July 10,107.7 hrs on record,Still better than AC Odyssey,1 person found this review helpful,Recommended
633,Posted: July 10,20.0 hrs on record,"Personally speaking, the game didn't really keep my attention, though that may have just been my mood at the tine. In any case, if I have any advice it would be this: don't by this game for the ""cutscenes"" alone.(you know the ones I'm talking about).",No one has rated this review as helpful yet1 person found this review funny,Not Recommended
634,Posted: July 10,41.0 hrs on record,I fell in love with this game on my first playthrough. One of the best game i've ever played in my life. Good job CDPR,1 person found this review helpful,Recommended
635,Posted: July 10,25.4 hrs on record,Gud.many many fun left and right,1 person found this review helpful,Recommended
636,Posted: July 10,3.0 hrs on record,make this game free than it would be worth it,No one has rated this review as helpful yet4 people found this review funny,Not Recommended
637,Posted: July 10,281.7 hrs on record,"Product received for free
 F**ing amazing game",1 person found this review helpful,Recommended
638,Posted: July 10,17.9 hrs on record,Mmmmh I wish geraldo sold his bath water to me i'd slurp that ♥♥♥♥ up like I do with soy milkshakes and death grips albums,2 people found this review helpful,Recommended
639,Posted: July 10,166.0 hrs on record,Really Feking Gud.,1 person found this review helpful,Recommended
640,Posted: July 10,167.9 hrs on record,BEST STORY GAME I EVER PLAY!!!,1 person found this review helpful,Recommended
641,Posted: July 9,530.9 hrs on record,"Don't really need to say much about this game really, it's a very rare occasion where you can feel the passion the developers have by simply playing the game, and this game is all about it.",No one has rated this review as helpful yet,Recommended
642,Posted: July 9,9.2 hrs on record,One of the best single player experiences you will ever have in your life time. Why are you even looking at reviews? Buy the game already.,No one has rated this review as helpful yet,Recommended
643,Posted: July 9,59.5 hrs on record,"Product received for free
 Hands down the best story driven video game I've ever played. Possibly the best video game period.",No one has rated this review as helpful yet,Recommended
644,Posted: July 9,0.1 hrs on record,I CANT BE RACIST TO MAGES,1 person found this review helpful6 people found this review funny,Not Recommended
645,Posted: July 9,59.1 hrs on record,"If I could leave a neutral review for this I would, but I love the game too much to make it negative overall.The game itself is great, a 9/10With all the issues I'd give a 6/10Cons:Very clunky movement, especially painful in small spaces or near ledges making you get stuck or die at timesBad visual glitches and pop-inHorse controls.Gear randomly unequipped by itselfSwitching signs not working half the timeVery repetitive musicBad endingHowever the game crashes frequently, game breaking bugs happen a lot and it straight up breaks my PC and forces me to restart.7/10",1 person found this review helpful,Recommended
646,Posted: July 9,66.5 hrs on record,"What up my ♥♥♥♥♥s its Barack Obama. Lets talk about how much I ObamaCARE about The Witcher 3. The story is so good, yet the world is so open and vast that I don’t flipping know how CD Projekt Red did it! As former BLOTUS (Black Leader of the U.S.), I award The Witcher 3 with a Presidential n-word pass. Use it wisely while developing The Witcher 4.",No one has rated this review as helpful yet2 people found this review funny,Recommended
647,Posted: July 9,15.0 hrs on record,I can honestly say that this game was one of those games that would never lose my attention. I could play this game every day for a year and wouldn't get bored.  The Witcher 3 has a vast open map to explore and with in it has 1000+ hours of quest to do from fighting a peasants for money to slaying a half lion half dragon beast. The only thing I would give for a tip is to just enjoy the game and play to your hearts content 10/10,1 person found this review helpful,Recommended
648,Posted: July 9,14.5 hrs on record,Very very very very very very very very very very very very very very very enjoyable.,No one has rated this review as helpful yet,Recommended
649,Posted: July 9,85.3 hrs on record,"Ah sh*t, here we go again.",No one has rated this review as helpful yet,Recommended
650,Posted: July 9,63.7 hrs on record,I finished game at worst ending...I feel dead inside PepeHands,No one has rated this review as helpful yet1 person found this review funny,Recommended
651,Posted: July 9,7.9 hrs on record,Good game,No one has rated this review as helpful yet,Recommended
652,Posted: July 9,50.1 hrs on record,Best game ever i come from fable and this is a whole diffenrnt level to thing must get so much fun,No one has rated this review as helpful yet,Recommended
653,Posted: July 9,240.0 hrs on record,"It is a little bit late for a review, considering the game is 4 years old by now. Starting with a TL;DR. It absolutely is worth the investment.   There is no way to deny its positives aspects.   Aesthetically, it is downright stunning: impecable lighting, intricately detailed textures, lush forests, vibrant colors, complex weather patterns, and very vivid sounds. The world seems very much alive.    Gameplay-wise this game has everything you could wish for in an open-world RPG. You are free from the very first minute of gameplay and the are only loose recommendations of what you should do next. Of course there's is the overarching story guiding you towards a specific end, but you're not constrained by it. The game has a set of specific checkpoints, specific missions, or quests, where you must arrive. Between these checkpoints ( missions ) you have complete freedom. This freedom however makes it difficult for the game to account for every single path, and sometimes you will feel railroaded into a cutscene that makes no sense in your playthrough because you took a different path toward said checkpoint. But this is a minor issue.   Where the game does not shine so brightly, however, is in writing, and most worringly in acting, or voice-acting. The universe they have created is interesting and full of life, but the story is not very engaging. I attribute this to the challenge of creating a plot to guide the player, but also leaving it open-ended enough to allow the player free-will. The more glaring issue, however, is in character writing. Most characters have stiff dialogue, which is made even worse by the below average voice-acting most characters have. Geralt's voice-acting sounds like a caricature, like Christian Bale's batman. Go on youtube and listen to Geralt's voice actor speak and draw your own conclusions. Most accents sound silly and forced. Every single instance, in which I had my suspension of disbelief broken was because of cringeworthy dialogue lines delivered in a mediocre maner. Now CDPR is a relatively small studio and voice-acting can gobble up a large piece of budget, so it is understandable.   Regarding gameplay mechanics, this game is very solid. There are minor issues with automatic targeting and key registration at times. But even on the highest difficulty it will not be a big issue. User interface, specifically inventory, has seen upgrades since launch but still is one of the games greatest shortcommings in this area.    There is nothing to complaint in matters content. CDPR claim you can finish the game in anything between 25 and 75 hours. It took me 150 hours to finish the base game, no expansions. And one of the expansions, Blood and Wine, is as big as a standalone game. It clearly is more than a bargain considering the price.   Despite my complaints this game is amazing. I do not want to ""hate on it"", but I do believe in sharing my experience and thoughts. And I will be replaying all 150 hours of base game plus however many DLC hours. I am glad I found this game after I was disappointed by the ME:Andromeda fiasco.",No one has rated this review as helpful yet,Recommended
654,Posted: July 9,69.1 hrs on record,"Garbage pisaa shiiiiiiiiiiiiiit XDAlright, lets check this. Main story finished in 60.9hrs. Lets skip the ''tutorial'' which is approximately 20 hours... This 20hours will be pain in the ♥♥♥ remember that, I stopped counting how many times i rage quitted the game :D. To me, game starts the moment you contact Triss. After that, you MAY finally enjoy the game.- Combat is meehh, expected better tbh.- I cant imagine a gps as bad this as one :p- How could you possibly die by falling from 1 meter? christ...- Stupid quests... I mean, really? Witcher! Go bring my sheep or whatever the ♥♥♥♥ it is. Oi Witcher! Find my wife goddemitttt. Hey Witcher, I know what your talking about but i wont tell you until you do as i say you ♥♥♥♥ing...- Your power is unbalanced. You are too weak at the beginning and you are too powerful at the end. Didnt even take damage from the final boss.-normal difficulty-- Bug, bugs, more bugs, more and more bugs, BUGBUGBUG.+ Fortunately, at least characters are lovely, like Triss :p+ Atmosphere is okkk.+ Story is okkk but just as i said, stupidddd quests throughout the game are disheartening and mostly distracting.+ Graphics, naysssuuu.So, if you have enough patience to beat slave simulator, -first 20 hours- or have some special reasons to play it, go for it. Otherwise I would not recommend it.7.5 out of 10? maybe?HLAKBR  XD",1 person found this review helpful,Not Recommended
655,Posted: July 9,86.6 hrs on record,"One of the only games worthy of the title ""Masterpiece"" It is still my greatest game of all time and seems like it will be for a good while.",1 person found this review helpful,Recommended
656,Posted: July 9,65.6 hrs on record,can't procreate with ciri 0/10,1 person found this review helpful1 person found this review funny,Recommended
657,Posted: July 9,18.4 hrs on record,"i havent played much of this game yet, but so far its good9.5/10",No one has rated this review as helpful yet,Recommended
658,Posted: July 9,0.4 hrs on record,Must to play. Best RPG from 2015 to present.,No one has rated this review as helpful yet,Recommended
659,Posted: July 9,98.2 hrs on record,"Main Game: The Witcher 3 is a very big and fun game which is breathtaking. There are many quests and items alongside a heap of interesting characters. The game puts a dark spin on many child stories like ""Snow White and the Seven Dwarves"" and many more. The game is not too long or too short but when you do finish it you also want to dig into the DLC as quick as possible. There are many locations which are similar but unique in their own ways. This is hard to pull off but CD Projekt Red pulled off. I definitely recommend the base game but i would strongly advise to buy the DLC.Hearts of Stone:I personally feel this DLC is underwhelming. It introduces new quests along with new characters and monsters but does not include a new location. This is going to be a very small spoiler but nonetheless  at the start of the DLC you kill the prince and are taken buy soldiers from Ofir, you then are taken to a ship but break out and is left on a beach to fight. I half expected we would be able to explore Ofir but I was left disappointed . This is my only downside of the DLC you do get to see new place within ""The Northern Kingdoms"". The quests are fun and engaging and you see "" an old friend "" you need to use your head to solve riddles if you take a certain path.Blood and Wine:This DLC is the best DLC i have ever played in any game. The setting of a magical and fairy-tale Toussaint. The landscape is amazing and very colourful. The quests are very interesting and I really enjoy the Vampire theme of the DLC. The characters you meet live up to the stories of medieval knights and common folk. You can uncover some ""skeletons in closets"" of some people. I really recommend this DLC. It is hard for me to describe it so just play it and see for yourself how amazing and almost nostalgic the DLC is.",No one has rated this review as helpful yet,Recommended
660,Posted: July 9,112.5 hrs on record,Heeey That's pretty Good !,1 person found this review helpful,Recommended
661,Posted: July 9,29.5 hrs on record,"Just a few bugs , but the story is compensating for them",No one has rated this review as helpful yet,Recommended
662,Posted: July 9,172.3 hrs on record,PROS:- Great main story line.- Relatable and realistic (or as realistic as someone can be in a fantasy universe) characters.- Fun and challenging combat.- Incredibly fun side quests that you actually want to complete.- Amazing graphics and animations.- Interesting and beautiful in game locations.- Fist fighting a bearCONS:- Has ruined other games for me.10/10,1 person found this review helpful1 person found this review funny,Recommended
663,Posted: July 9,25.2 hrs on record,"Love the game! Bought it on PS4 originally and bought it again for PC it’s that enjoyable.the graphics are spot on, the characters are well thought out. The story draws you in and is replayable. On a second run though there’s always more to pick up. Get it now whilst on sale! Bargain!",No one has rated this review as helpful yet,Recommended
664,Posted: July 9,492.9 hrs on record,"Parry enemies on all angles? Fight mythical legendary monsters? Experience amazing visuals and immersive world? Have infinite stamina? Hangovers? Yes, yes, yes, yes, yes!Wearable clown gear. Annoying NPCs. Unnecessary miss-able side quests. Yep...Pet dogs or cats? No. Jump from the 2nd story of a building? Nope.2077/10 would play again.",No one has rated this review as helpful yet,Recommended
665,Posted: July 9,160.4 hrs on record,Well what should i say. Buy it of course.,1 person found this review helpful,Recommended
666,Posted: July 9,83.9 hrs on record,Best. Game. Ever. Made. Can't wait for Cyberpunk!,1 person found this review helpful,Recommended
667,Posted: July 9,47.5 hrs on record,"10/10, AAA ... game",1 person found this review helpful,Recommended
668,Posted: July 9,10.6 hrs on record,gud game,No one has rated this review as helpful yet,Recommended
669,Posted: July 9,88.7 hrs on record,"Long and thorough storyline, wide open world for exploration, as well as excellent DLCs. Best game I've played in a long time.",1 person found this review helpful,Recommended
670,Posted: July 9,96.1 hrs on record,Gameplay- 10/10Main Story - 7/10Hearts of stone story- 9/10Blood and Wine story- 10/10MapsWhite Orchard- 6/10Velen (extended using Hearts of stone DLC) - 9/10Skellige- 7/10Toussaint- 10/10Kaer Morhen- 7/10Best girl - Brewess,2 people found this review helpful,Recommended
671,Posted: July 9,12.3 hrs on record,Roach is a God,No one has rated this review as helpful yet,Recommended
672,Posted: July 9,133.6 hrs on record,Phenomenal.,No one has rated this review as helpful yet,Recommended
673,Posted: July 9,45.8 hrs on record,A masterpieces!!!,No one has rated this review as helpful yet,Recommended
674,Posted: July 9,192.0 hrs on record,"Great story, great gameplay, amazing in general.Huge open world that doesn't feel empty, littered with unique quests and enemies.",No one has rated this review as helpful yet,Recommended
675,Posted: July 9,58.0 hrs on record,"hey, that's pretty good",No one has rated this review as helpful yet,Recommended
676,Posted: July 9,91.3 hrs on record,The best experience I've ever hadi cant wait to see what this Developers can make,No one has rated this review as helpful yet,Recommended
