,date_posted,playtime,review,helpful_funny,recommended
441,Posted: July 16,135.8 hrs on record,"This game is not bad at all, but not impressive either.I personally enjoyed it to some extent, but the game is not deserving such a good reception.I give this game a 7/10.It is not a bad game, but certainly it doesn't deserves it's overwhelming good reviews.Play it if you are bored. Not a great game but a good time filler when waiting for better games.The combat is dull but passable.The story is above average but not great (basically ""save the princess"" done well).Character customization is poor.Loot is uninteresting.",2 people found this review helpful1 person found this review funny,Not Recommended
442,Posted: July 16,189.5 hrs on record,"Story: 9.8/10DLCs: 9.5/10Gameplay: 8.0/10Side Quests: 9.2/10Graphics: 10/10PC Port: 9.0/10Had more fun during my second playthru than my first and usually thats not the case for most games. The Story: actually makes you feel immersed in the game, care about every important character, and makes you think twice about which dialogue choices you pick. It didnt take long for me to become attached to the lore of the world, characters, and story thus when the game was nearing a close i felt sad and even an empty pit in my stomach knowing that this would be Geralts last game. The Gameplay: although it is the weak point of the game I feel it gets the job done. during my second playthru i gained a better understanding on how to fight in the game and its really not a bad experience especially if you know how to upgrade your character that fits your unique play style. Understanding how to craft Oils/bombs make the gameplay more enjoyable and crafting good armor that has phat bonuses will help you in fights. The physics, gore, and slicing through enemies limbs is also another plus of the gameplay.The DLCs: Both DLCs are great just get the game of the year edition when its on saleSide Quests: 95% of the side quests ive taken part of are good mini storys that are usually unique from one another, the other 5% is just your average fetch quest RPG stuff. Witcher contracts can have interesting twits but some are just your run of the mill contract to get some extra cash. treasure hunts are treasure hunts ;)Graphics: For a game that came out in 2015 these graphics are legendary and i find myself looking and taking screenshots of a ton of scenery.PC Port: I have ♥♥♥♥ specs (AMD FX 8320 overclocked to 4.1GHz (the fx processor serves as a heater too lol), R9 380x, 12GB 1600 Ram) and this game runs at 35-42 fps on a mix of ultra and high settings... the port is good Verdict: If the Combat was better it would be close to a 10/10 but since its not imma give it a solid 9.2/10.P.S. Those who say the game is bad simply because of the combat are stupid hipsters. Fallout 3 had ♥♥♥♥ combat and the game was critically acclaimed by fans... nuff said",3 people found this review helpful,Recommended
443,Posted: July 16,109.6 hrs on record,Easily the best open world RPG I have ever played.,No one has rated this review as helpful yet,Recommended
444,Posted: July 16,173.6 hrs on record,Buy it you monkey,3 people found this review helpful1 person found this review funny,Recommended
445,Posted: July 16,29.3 hrs on record,"Great Graphics, Great Gameplay. I recommend.",1 person found this review helpful,Recommended
446,Posted: July 16,68.2 hrs on record,Legendary RPG.,No one has rated this review as helpful yet,Recommended
447,Posted: July 16,271.7 hrs on record,Masterpiece.,No one has rated this review as helpful yet,Recommended
448,Posted: July 16,11.8 hrs on record,"Great Story, Great Gameplay, Great Cutscenes. 10/10. Love it.",No one has rated this review as helpful yet,Recommended
449,Posted: July 16,102.5 hrs on record,Simply fantastic,1 person found this review helpful,Recommended
450,Posted: July 16,242.3 hrs on record,This is my favorite game of all time.,No one has rated this review as helpful yet,Recommended
451,Posted: July 16,141.9 hrs on record,"I don't normally play RPGs, but I can't stop playing this game. The story is great, the quests are fun, and the world looks pretty. Overall this game is just amazing and I highly recommend trying it",No one has rated this review as helpful yet,Recommended
452,Posted: July 15,145.8 hrs on record,Genuinely the best single-player game to ever be created.,No one has rated this review as helpful yet,Recommended
453,Posted: July 15,99.7 hrs on record,"CD PROJEKT RED's The Witcher 3: Wild Hunt, is by leaps and bounds the greatest game I've ever played. Not only is it's world vast, but its rich with characters to meet and things to do. Clocking in at an impressive 80 hours, I have managed to finish the main story and it's 2 dlc's, but that's just their stories alone. I still have plenty of things to see, side quests to do, contracts to complete. Also worth mentioning as of yet I haven't touched any of the games crafting mechanics.I'm not going to touch any of the story, or even give it a brief synopsis, as it's simply a must to experience for yourself. The world CDPR have depicted here is filled with locations and plenty of attention to detail all around. The world itself is gorgeous and looks visually stunning. I personally have become so incredibly invested into its story and lore that you can only believe how difficult it was when the time I was always dreading (that I'm sure many did too) was when it finally ended. The vast amounts of different personalities and characters you will meet in this game is fascinating, The quests themselves are always intriguing and sometimes you never know if the side quest you're about to take on will take 10 minutes of your time, or if it'll take 2 hours, as with this game you truly will never know. Time flies. I was only going to fetch some armor diagrams when next thing I know, I've been ticking off side-quests and suddenly here I am completing the final DLC, 5 hours down the line, at 5am.This game has been a breath of fresh air for me, in a time where I've found single player games almost a chore, and with an ever increasing backlog, I found it hard to ever see myself having the ability to finish something. Yet, after crossing that hurdle, I suddenly don't know how to feel because part of me didn't want to see Geralt's story end, and that's upsetting.It's obvious why this game deserves all the praise it gets, because the passion that has gone into this game is admirable in a time of corporate greed. This is a game that you can pick up for £14, including all it's DLC in a sale, regularly. That's obscene. This game is easily worth £50, and I'm glad I paid that for it as this company truly deserves all the support and plaudits they can get.It's one of those things you can only experience for yourself, and it's one that you only truly get the most out of if you sit down, immerse yourself and soak it in, in all of its glory.This game is beyond anything else I have ever played and it's become a precedent when it comes to determining how good I deem a game to be, which unfortunately will result in me being unsatisfied with a LOT of games. Truly Game Of The Year, every year, forever. Thank You CD PROJEKT RED.tl;drGreatest game ever made.",No one has rated this review as helpful yet,Recommended
454,Posted: July 15,11.6 hrs on record,very good RPG,No one has rated this review as helpful yet,Recommended
455,Posted: July 15,118.7 hrs on record,Great,No one has rated this review as helpful yet,Recommended
456,Posted: July 15,82.9 hrs on record,"One of my top 5 games of all time, loved everything about it to the combat mechanics (and how every monster is different in the way you fight them), the decisions that alter every playthrough so its a different experience each time, the volume of quests to do that don't feel like a chore to complete and of course the odd glitch that just funny. Seriously recommend this game to anyone that is slightly interested.",No one has rated this review as helpful yet,Recommended
457,Posted: July 15,105.5 hrs on record,:),No one has rated this review as helpful yet,Recommended
458,Posted: July 15,31.8 hrs on record,A good game with a great and long storyline. With up to 300+ Hours of content.,No one has rated this review as helpful yet,Recommended
459,Posted: July 15,189.5 hrs on record,Haven't gotten this lost in a game in quite a while. Absolutely brilliant story telling,1 person found this review helpful,Recommended
460,Posted: July 15,7.9 hrs on record,"one of the best games in the world, i would suggest for anyone to buy it immediately if they haven't done so! you will enjoy every moment, although its more enjoyable on a slightly higher difficulty... my personal opinion",No one has rated this review as helpful yet,Recommended
461,Posted: July 15,40.6 hrs on record,i like falling off small cliffs that is the equivalent to a regular jump and dying instantaneously,No one has rated this review as helpful yet,Recommended
462,Posted: July 15,38.1 hrs on record,12/10,1 person found this review helpful,Recommended
463,Posted: July 15,41.6 hrs on record,A very good and fun rpg. Maybe one of the best I've ever played.,1 person found this review helpful,Recommended
464,Posted: July 15,12.2 hrs on record,ehhh,No one has rated this review as helpful yet,Recommended
465,Posted: July 15,1.5 hrs on record,uhm yes?,No one has rated this review as helpful yet,Recommended
466,Posted: July 15,47.6 hrs on record,It took me more than 4 years to buy this game after many people are asked why don't have it yet. Already played 14 hours and so much I have enjoyed. Excellent story so far and 2015 graphic with HD project mod is the best what I have seen. So much exploring and not tired to stop exploring. Feels great to play this now.Only bad side on this game are some bugs: Stuck on horse saddle and  during the conversation.Still recommend if you haven't it yet.,2 people found this review helpful,Recommended
467,Posted: July 15,48.1 hrs on record,Just power through until you get to the bloody Baron that's when things starts to get fun. (P.S) Buy the Dlcs,No one has rated this review as helpful yet,Recommended
468,Posted: July 15,57.1 hrs on record,triss > yenneferedit: triss > shani > yennefer,1 person found this review helpful,Recommended
469,Posted: July 15,180.8 hrs on record,Amazing landscapes. Such depth to the story and the quests. And so much freedom within the game. Truly a masterpiece.,No one has rated this review as helpful yet,Recommended
470,Posted: July 15,113.8 hrs on record,There is only one word needed to describe this game. MASTERPIECE.,No one has rated this review as helpful yet,Recommended
471,Posted: July 15,257.8 hrs on record,"One of the best games I've ever played, great story, great fighting mechanics, just great overall.",No one has rated this review as helpful yet,Recommended
472,Posted: July 15,153.5 hrs on record,"You can kill some amorphous monsters with Bulgarian wedding music, even the dumbest secondary quest has a cinematic and a dose of witcher's sarcasm and humour as the cherry of the cake.10/10",1 person found this review helpful1 person found this review funny,Recommended
473,Posted: July 15,508.4 hrs on record,Great,3 people found this review helpful,Recommended
474,Posted: July 15,55.8 hrs on record,"I'm sorry. I do like this game. I had a great deal of graphically awesome moments in the 56 hours I played. It is a very high quality, true AAA production graphics and sound wise. The gameplay has good moments too....Otherwise, it's a boring snooze fest. The running from one NPC to the other, the bad crafting, the absolute weird amount of.....TRASH items that have no purpose, the completely tiring amount of dialogue all spoken by the very very monotone Geralt. The menu diving is bad, the skills/leveling is meh....I'm giving this a thumbs down. Just cuz everyone else has given it so many thumbs up. I think its due for an honest thumbs down.  There's a great deal about it, besides the high production quality of the tireless amounts of voice-overs and very good animations, that just....sucks. The movement is also a chore - you have to fight the game to go in a straight line and just kind of go with it....while you correct the camera. The magic is disappointing. It just is. The alchemy is...weird. You just need alcohol to recreate what you made before - it doesn't make any sense - you just meditate and if you have alcohol, everything gets re-created. I got my money out of it at 55 hours, and I just finally got past Valen and Novigrad. The graphics are like nothing you've ever seen. They are very good. Performance is very good on a 1060 6gb/32ram i7 - Zero complaints.  It's quality, well running and performing software. I really am not sad about my purchase. However, stepping off the bandwagon > This game is great in some ways, but lame in other ways. For sure. I puts me to sleep. Getting to 56 hours was a pretty sleepy chore except for a few cool characters along the way. It's a solid 8 in my opinion. The women in the game are soooo cardboard, but so is Geralt = stiff and monotone to a fault. It's a great deal on sale and one of those games that's rated so high, it's worth it to be in your library to at least try and you just might love it. I found I don't love it. Yes, it took 56 hours but I was simply trying to get through it.",6 people found this review helpful2 people found this review funny,Not Recommended
475,Posted: July 15,28.0 hrs on record,The best RPG i ever played in life,No one has rated this review as helpful yet,Recommended
476,Posted: July 15,307.9 hrs on record,"What more should i say about The Witcher 3, that hasn't been said already.It's a Masterpiece and will always have a special place in my heart.",No one has rated this review as helpful yet,Recommended
477,Posted: July 15,505.1 hrs on record,"10/10 would replay again, forever :))CDPR (one of) best devs, no doubt",1 person found this review helpful,Recommended
478,Posted: July 14,157.2 hrs on record,/r/gamingcirclejerk,No one has rated this review as helpful yet,Recommended
479,Posted: July 14,440.8 hrs on record,"""The world is in danger of being destroyed and I have an important mission. But let me go finish up all my side quests and explore all undiscovered locations first."" 9.5/10.",No one has rated this review as helpful yet,Recommended
480,Posted: July 14,109.5 hrs on record,"An absolute masterpiece. CDPR has created an imersive game-world which is second to none. Words alone can not describe just how much emotion and work has been put into this game. I laughed, I cried, and I recoiled in my seat from the story unfolding on my screen. Furthermore, CDPR combines a wealth of content with handcrafted detail, sacraficing nothing.Worth ... Every ... Penny. | 10/10 Would, and have played again |",No one has rated this review as helpful yet,Recommended
481,Posted: July 14,9.9 hrs on record,Overrated but still great.,No one has rated this review as helpful yet,Recommended
482,Posted: July 14,36.9 hrs on record,One of the greatest games ever developed.,No one has rated this review as helpful yet,Recommended
483,Posted: July 14,318.2 hrs on record,"I've invested over 300 hours in this game across all of the DLC, and I still haven't had enough of it. If you played and enjoyed Skyrim, you're going to love Witcher 3 even more, and that's not an exaggeration. The game play world is beautiful, and the attention to detail is shockingly amazing. All around you, especially in the towns and cities, are NPCs going about their business and doing things you'd actually expect people in the real world to be doing. Listening in on conversations or observing NPCs going about their 'lives' that have nothing do with any quest in the game adds a level of realism that I've just not seen before in another title. Kudos to CD Projekt Red on the Steam Best Environment Award 2018 - well deserved! The main stories and side quests are interesting, humorous at times, cover the full difficulty spectrum, and only occasionally seem like a grind. The character development is fantastic, with highly thought out back stories for the supporting cast. Honestly, when I finished the main game and prepared for the expansion packs, I was actually sad to learn that I wouldn't be seeing most of the main characters again. A++ recommendation. I can't wait for Witcher 4 to come out.",No one has rated this review as helpful yet,Recommended
484,Posted: July 14,97.4 hrs on record,Quests. Worth. Your. Time.,No one has rated this review as helpful yet,Recommended
485,Posted: July 14,55.5 hrs on record,Masterpiece,1 person found this review helpful,Recommended
486,Posted: July 14,38.1 hrs on record,Just the best game ever created,No one has rated this review as helpful yet,Recommended
487,Posted: July 14,65.6 hrs on record,This game is a masterpiece. Can't wait for Cyberpunk 2077 from CD Project Red.,No one has rated this review as helpful yet,Recommended
488,Posted: July 14,39.1 hrs on record,GOTY...........,No one has rated this review as helpful yet,Recommended
489,Posted: July 14,109.4 hrs on record,"+) Great story.+) Easy and straightforward HUD and Interface.+) Optimized game mechanics.+) Future changing by the choices I make was very interesting.+) Fantastic scenery! Bravo!+) Voice actors, acting of main characters are superb!+) Intriguing and deep dialogues.+) Generous fast travel points.+) DLC is better, deeper, more heart moving than the main game?!-) Too much dialogues though. Side quests could've used more short and direct lines.-) There are too many side quests and they're long because of all the dialogues. This puts you off from main story, less heart moving.-) More linear approach in gameplay would've been a good solution for previous mention. Not entirely, just more.-) Novigraad and Velen have background music for sleeping or feeling down.-) You can't run or see world map right after fast traveling.",No one has rated this review as helpful yet,Recommended
490,Posted: July 14,55.6 hrs on record,"This game is amazing.The graphics are extremely good, it supports Nvidia Hairworks, and the story is beyond anything I have personally experienced. I highly recommend this game to anybody, for it is truely a masaterpiece.",1 person found this review helpful,Recommended
491,Posted: July 14,77.1 hrs on record,One of the best RPG ever made.,No one has rated this review as helpful yet,Recommended
492,Posted: July 14,150.2 hrs on record,"This game set the standard for open would fantasy RPGs.  It dethroned Skyrim.You can play this game as it without playing the previous two.  However, if you did play the first two Witcher games and imported your save file some of your decisions carry over.  I only recommend playing the first two if you are a die hard completionist.",No one has rated this review as helpful yet,Recommended
493,Posted: July 14,210.8 hrs on record,"The Witcher 3: Wild Hunt is a masterpiece of immersive storytelling and gameplay, from the seamless combat to the in depth character progression and emotional roller coaster that is the main story. Not to mention the fact that every side quest has its own main quest worthy story with every quest completed you walk away feeling satisfied and smiling.What a way to end the great story and emotional story of Geralt of Rivia, The white wolf.",1 person found this review helpful,Recommended
494,Posted: July 14,357.0 hrs on record,My favourite game of all time and an absolute masterpiece in every sense of the word.,No one has rated this review as helpful yet,Recommended
495,Posted: July 14,6.5 hrs on record,good game,No one has rated this review as helpful yet,Recommended
496,Posted: July 14,118.6 hrs on record,so many quests so little time,No one has rated this review as helpful yet,Recommended
497,Posted: July 14,65.1 hrs on record,"Keep Crashing, unplayable",No one has rated this review as helpful yet,Not Recommended
498,Posted: July 14,112.6 hrs on record,"Wonderful game, almost felt like a movie.",No one has rated this review as helpful yet,Recommended
499,Posted: July 14,173.8 hrs on record,"Pros:- vast, open, beatiful world- well writen story- likeable characters- great everythingCons:...........",1 person found this review helpful1 person found this review funny,Recommended
500,Posted: July 14,169.0 hrs on record,Good.,No one has rated this review as helpful yet,Recommended
501,Posted: July 14,30.3 hrs on record,Best game I ever played.,No one has rated this review as helpful yet,Recommended
502,Posted: July 14,87.8 hrs on record,good game (has tiddies),No one has rated this review as helpful yet1 person found this review funny,Recommended
503,Posted: July 14,17.4 hrs on record,Yennefer is Hot,No one has rated this review as helpful yet,Recommended
504,Posted: July 14,32.0 hrs on record,nice,No one has rated this review as helpful yet,Recommended
505,Posted: July 14,200.1 hrs on record,"What can I say that's not been said? The Witcher 3 is one of the best games I've ever played. I've put close to 200 hours into and it still doesn't feel stale. The music, the voice acting, the writing and story -- everything is truly top-notch. The world is so deep and so full of wonderful beasts, characters, quests, and places that it's easy to just lose yourself in it. Buy this game.",No one has rated this review as helpful yet,Recommended
506,Posted: July 13,54.3 hrs on record,"I regret not playing this game sooner. The Witcher 3 is easily my favorite game of all time at this point. It is truly what the word masterpiece is intended for. The amount of detail that CD Projeckt Red has put into this game never ceases to surprise and amaze me. I have only played through the main story one time and am near the end of all the expansions, but I feel that I will need AT LEAST another playthrough or two to experience most of the options this game has to offer. If you are on the fence about buying this game, purchase it along with all of the expansions and you will surely not be let down.",No one has rated this review as helpful yet,Recommended
507,Posted: July 13,62.3 hrs on record,"The Witcher 3 is a masterpiece. A 10/10. A near-perfect video game. If you have yet to play this game, really, REALLY do yourself a favor. A simple 'thumbs up' icon severely underscores my feelings regarding this game. It's an open-world action RPG with a deep, mature storyline, a rich, nuanced world to explore, and a boatload of activities to just lose yourself in. I loved Witcher 2 before it, but playing that one is not necessary (though your save file can be imported).I'll try not to go off on a tangent. You've certainly read the other reviews telling you the same thing. Get this game, and definitely get the DLC too. There hasn't been a better game of this taste yet, so it is in your best interests to get the most out of this one. Play it.",1 person found this review helpful,Recommended
508,Posted: July 13,118.1 hrs on record,Hates Taxes,1 person found this review helpful1 person found this review funny,Recommended
