,date_posted,playtime,review,helpful_funny,recommended
203,Posted: July 25,354.9 hrs on record,"Top tier game, could recommend for anyone who's into openworld rpgs, gotten about 350 hours out of this masterpiece and i am not done yet.",1 person found this review helpful,Recommended
204,Posted: July 25,0.5 hrs on record,oh my ******** god this game had me bored out my mind,4 people found this review helpful,Not Recommended
205,Posted: July 25,227.4 hrs on record,"I had to give this game a few chances. I really wasn't into the game or combat for about the first 8 hours. Once I started exploring Velen, the whole game opened up, and has become one of my favorite games of all time. I'll post a full review when I finish the game.",No one has rated this review as helpful yet,Recommended
206,Posted: July 24,123.6 hrs on record,First game I've ever put over 100 hours into. Excellent game still in 2019.,No one has rated this review as helpful yet,Recommended
207,Posted: July 24,168.6 hrs on record,Witcher 3 > Skyrim.,2 people found this review helpful,Recommended
208,Posted: July 24,70.2 hrs on record,In my Top 3 for all time best RPGs.★★★★★Nexus Guarantee ✔,No one has rated this review as helpful yet,Recommended
209,Posted: July 24,54.0 hrs on record,Person wanting to buy this game: So how good is this ga-Me: YES This game is an absolute ♥♥♥♥ing masterpiece and nails pretty much everything it tries to score at. Just buy the game already.,No one has rated this review as helpful yet,Recommended
210,Posted: July 24,157.4 hrs on record,What are you waiting for? buy this game already... sale or no sale its worth the money,No one has rated this review as helpful yet,Recommended
211,Posted: July 24,483.6 hrs on record,One of the greatest games ever madea true masterpiece,No one has rated this review as helpful yet,Recommended
212,Posted: July 24,102.5 hrs on record,Best steam sale bargain.,1 person found this review helpful,Recommended
213,Posted: July 24,42.4 hrs on record,"Only a few hours in so far, but it's one of the best games I've ever played",No one has rated this review as helpful yet,Recommended
214,Posted: July 24,127.1 hrs on record,10/10,No one has rated this review as helpful yet,Recommended
215,Posted: July 24,75.8 hrs on record,i have not played the game to much i didnt like it on consle and refunded it on pc and bought it again because i wanted to give it a second chhance now that i am stuck with it i decided ''Why not play it i am bored '' now that i got through some of the missions and got better at combat i love it i would say the best game on this platform,No one has rated this review as helpful yet,Recommended
216,Posted: July 24,441.9 hrs on record,"One of the best games I have ever played, simply 10/10.",1 person found this review helpful,Recommended
217,Posted: July 24,408.3 hrs on record,I can't go back to Bethesda after this game.,1 person found this review helpful1 person found this review funny,Recommended
218,Posted: July 24,2.0 hrs on record,... G.O.A.T. this is the best RPG I've ever played,No one has rated this review as helpful yet,Recommended
219,Posted: July 24,109.3 hrs on record,sexy beard,No one has rated this review as helpful yet,Recommended
220,Posted: July 24,52.4 hrs on record,Haven't played it.,No one has rated this review as helpful yet,Recommended
221,Posted: July 24,127.9 hrs on record,This game is an epic journey.,No one has rated this review as helpful yet,Recommended
222,Posted: July 24,5.1 hrs on record,Best dating sim I've played,No one has rated this review as helpful yet2 people found this review funny,Recommended
223,Posted: July 24,181.7 hrs on record,10/10,3 people found this review helpful,Recommended
224,Posted: July 24,22.8 hrs on record,Best RPG iâ€™ve ever played!,No one has rated this review as helpful yet,Recommended
225,Posted: July 24,118.4 hrs on record,Best game,1 person found this review helpful,Recommended
226,Posted: July 24,12.4 hrs on record,10/10,No one has rated this review as helpful yet,Recommended
227,Posted: July 24,85.5 hrs on record,more like LITcher 3,No one has rated this review as helpful yet,Recommended
228,Posted: July 24,59.2 hrs on record,"It's the witcher, do I need to explain why this is the bomb.",No one has rated this review as helpful yet,Recommended
229,Posted: July 24,148.9 hrs on record,The best creation of humanity,1 person found this review helpful,Recommended
230,Posted: July 24,2.4 hrs on record,"Product received for free
 Eat potatos to gain HP :v",No one has rated this review as helpful yet,Recommended
231,Posted: July 24,94.1 hrs on record,An absolutely amazing game!,No one has rated this review as helpful yet,Recommended
232,Posted: July 24,20.9 hrs on record,best game ever!!,No one has rated this review as helpful yet,Recommended
233,Posted: July 24,273.9 hrs on record,"Overhyped regular game. Battle mechanic has 2 buttons but only light atack is realy good, no combos, only at the end armor's bonuses and abilities give u reason not to spam light atack. Witcher 1 had 3 styles - witcher 3 has 0 styles. Withcer 1 requested no to spam one atack, requested to use potions, and requested to adapt for situation. In 3rd game u don't need anything but heal and spam light atack... goodlike 10/10???Quest sometimes has good story, but mostly they are boring about another %quest_giver% wich has problem with %monster_name% bla-bla-bla witcher pls save us. Character from the books are good (becasuse they have made by Sapkovsky), rest are boring and terrible stupid (created by cd prodject red) - they just broke any lojic, rules of the lore and game mechanics not working for them. Main quest about Wild Hunt - mystical and powerfull... but there some trash idiot near by that just be immortal, just be extrymly powerfull.There is no openworld. It boring several big locations without simulation of the world. But! Devs ruined exploration: near location with 10 lvl monsters you can easy find 30 lvl monster... Just 10 out of 10.Game has number 3. Does it has connection with previos games? Allmost none. Devs put some remarks to side quests and dlc, like previos games wasn't exist. Yorvet? Forget about scoya'tael. And every time, when you find something good - some idiotic and stupid thing ruined impressions again and again.Game has ng+. Does the game have the potential to re-run? No. Bad game mechanics, no real big changes because of choices, dead open-world.7/10 just good game for play it ones only if you fun of previos 2 games, nothing more.",2 people found this review helpful2 people found this review funny,Not Recommended
234,Posted: July 24,56.4 hrs on record,"Yes, i know, i'm late to the party. I only just invested in this game. I seldom write reviews, but this game? Where to begin!Graphically, it is beautiful. The level of detail is incredible. The music helps to absorb you into the realm of the witcher. It is expansive, plenty of things to see and do and so much to explore.Where it really does it for me, is in the story telling. The depth of it is incredible, the consequences of each action revealed later, are amazingly well thought out.If you do only one more thing in your life, buy this!",No one has rated this review as helpful yet,Recommended
235,Posted: July 24,219.5 hrs on record,10/10 Would bang all the Characters in the game,1 person found this review helpful,Recommended
236,Posted: July 24,74.7 hrs on record,I want more main quests :(,No one has rated this review as helpful yet,Recommended
237,Posted: July 23,29.4 hrs on record,Best rpg game...no need to talk just buy it....,No one has rated this review as helpful yet,Recommended
238,Posted: July 23,4.1 hrs on record,gud game wud recommend,1 person found this review helpful,Recommended
239,Posted: July 23,238.1 hrs on record,pamparam pam pam param,No one has rated this review as helpful yet1 person found this review funny,Recommended
240,Posted: July 23,489.0 hrs on record,I like it.,No one has rated this review as helpful yet,Recommended
241,Posted: July 23,49.7 hrs on record,"I never played the other Witcher games, didn't even know there was a book. The developers made it very easy to catch up on the storyline for first time players.First off, the game is exceptional and gets my recommendation as a virgin Witcher.The battles have an art form to them which I've appreciated, and the soundtrack is now something I hear in my sleep and find myself whistling throughout the day. Be prepared to catch that.There are minor glitches that just frustrate me beyond belief, but that's me being autistic about it and I should report it or something. Some mechanical, one specifically, but the rest of the mechanics introduced by the game outweigh the nuisance of me not knowing how to run from a fight without rolling.Overall very great game and looking forward to playing Gwent more.",2 people found this review helpful,Recommended
242,Posted: July 23,102.7 hrs on record,roneee,No one has rated this review as helpful yet,Recommended
243,Posted: July 23,102.7 hrs on record,"Greta game buut daaaaaaaamn i played it first on console, soo osmooth but the PC version is â™¥â™¥â™¥â™¥ING garbage :D",No one has rated this review as helpful yet,Recommended
244,Posted: July 23,135.6 hrs on record,"Loved the game, the story was amazing.Would recommend.",2 people found this review helpful,Recommended
245,Posted: July 23,123.2 hrs on record,Nothing bad to say about the Witcher 3.,No one has rated this review as helpful yet,Recommended
246,Posted: July 23,335.5 hrs on record,One of the best games I have ever play and will always be one of my favorites. The game is story rich and full of hours of game play. All of the mystical creatures are unique and you're choices will have consequences later in the story or quest! Almost 200 hours in and still have side quests to do!,No one has rated this review as helpful yet,Recommended
247,Posted: July 23,37.3 hrs on record,"What a beautiful piece of art this is! This is a game I will not recommend to anybody that hates fantasy or scared of drowners like me, but play it in the morning and it's fine. If a quest start at morning, meditate and continue in the morning. A huge improvement from the Witcher 2, which I will not interview, but is also a beautiful game. I will finish this, just once, because I am â™¥â™¥â™¥â™¥â™¥â™¥â™¥â™¥ my pants scared of the monsters in this game and the really allergy affected Crookback bogs. I hope I get the good ending.",No one has rated this review as helpful yet,Recommended
248,Posted: July 23,183.3 hrs on record,"This game has an absolutely amazing story... I cried, I'm also crying while writing this comment thinking about the story! ðŸ’–",28 people found this review helpful4 people found this review funny,Recommended
249,Posted: July 23,"1,173.0 hrs on record",One of the best games ever created.,1 person found this review helpful,Recommended
250,Posted: July 23,116.0 hrs on record,10/10,2 people found this review helpful,Recommended
251,Posted: July 23,20.9 hrs on record,"First of all, I'm only describing the PC version here!I already had TW1 and TW2, but I still liked TW1 the best!First of all, the good thing about TW3 is of course the graphics. This is excellent. The sound, the music and everything else is also very harmonious. Of course the story is very good again.But that's where it stops! Already as in TW2 the controls are extremely console heavy and on the PC simply too jerky and bad (or simply ♥♥♥♥♥♥♥t...). If you want to dodge, or run away, it can take 2-3 seconds until the character reacts at all. Also in combat this makes itself unpleasantly noticeable again and again. The combat is simply ♥♥♥♥!Even with objects, you often have to run back and forth before you can pick them up. I was already standing in front of torches that you couldn't light at all because you weren't standing in front of them absolutely correctly.Other games like TES (Skyrim) have already shown how to do this better, but the developers seem to have learned absolutely nothing from the past.I've been thinking a lot back and forth about whether to rate TW3 good or bad. But it will be probably a thumb down, because TW3 is (exactly like TW2) too console heavy and the conversion of the controls on PC and many other little things leave much to wish for!I really hope that the developers don't make the same mistake with ""Cyberpunk 2077"" and that this also becomes too console heavy (controls and the combat system, skills...)! Because I am especially looking forward to this game and if they hadn't learned anything new, it would be a big disappointment and for me the end for games from these developers!To the developers! Guys, there's more than just console games! Try harder with the PC conversion and not just such a half-hearted crap!",1 person found this review helpful,Not Recommended
252,Posted: July 23,69.6 hrs on record,Wanted to play the witcher games before cyberpunk 2077 so i bought wicther 3 goty edition last steam sale. After 56+ hours i will say a enjoyed it but only good thing i liked about it was the world and some grayness in the choices. Combat is kinda meh and they don't do much about the romance choices making them more of a checkbox then a part of the story that makes you want to fight for a plot/character. I think i will take a break before i play the dlc stories. Overall i was expecting alot more.,No one has rated this review as helpful yet,Recommended
253,Posted: July 23,84.3 hrs on record,this  says 25 hours but ive had it on xbox and easily put 300 into it. if your a fan of rpg fantasy game youll love this game. stop putting it off and dive into one of the greatest games of all time. truly a beautiful story.,1 person found this review helpful,Recommended
254,Posted: July 23,1.6 hrs on record,400+ hours on my xbox. Game in incredible. Never thought I'd be able to find a game better than Skyrim.,1 person found this review helpful,Recommended
255,Posted: July 23,35.9 hrs on record,"Overrated game,that is why I give this title a negative review, the game itself is mediocre and would be more fun to watch than play(Story is quite good tho, and I would rather play this as an visual novel)However this particular game does not have any good mechanics whatsoever that would be at least above average (Combat system that can be pretty much summarized like this: You attack, dodge, attack,dodge and occasionally cast Yrden spell)If you have money and want to see an epic story, this game is for youBut..If you look for game with great mechanics and gameplay this is not game for you",2 people found this review helpful,Not Recommended
256,Posted: July 23,178.3 hrs on record,"The Witcher III is hands down one of the best RPG's I ever played.From the get-go the game pulls you into its amazing world and deep story and doesn't let you go until the end.The world is vast and completely open, allowing you to roam wherever you want, including climbing, swimming, horse riding etc.What I loved about this world is that it feels 'alive'. People go around their daily business, seek shelter when it starts to rain, have day/night cycles etc.The music complements the scenery perfectly and really adds to the atmosphere, leading to an overal dark and gloomy feeling of a very harsh medieval world.Even as a simple level 1 character you actually mean something i.e. no ""Clear the cellar rats"" stuff, but meaningfull quests and proper monsters to hunt. The game brings everything what you could wish for as an RPG: extensive parts/ingredients, crafting on different levels, alchemy, durability loss, multiple skill tree options offering different ways to build your character etc.The story is sublime, provides different options/branches and is littered with meaningful characters which are all well fleshed out. Even the secondary quests have nice story points, background info etc which again brings the whole world to life.Add different romancing options into the mix and you get an amazing story! Here and there the devs also added some Easter Eggs with references to 'DLC', 'DRM', 'GOG' etc. I played the game on the 'Blood and Broken Bones' difficulty and had a blast. At the start it was tricky, but once I progressed further the scales tipped over to the easy side.For replayability there is a Game+ mode and also an option to have monsters scale with your level.All in all it took me 178 hrs to finish everything, including all DLC, reaching Level 52.Regarding expansions I found the 'Hearts of Stone' expansion so-so.It in essence boils down to one big quest and gave me a feeling like it was just pasted in to add Shani again as a romance option.In many cases Geralt acts completely out of character in this DLC up to a point where it became a bit annoying.Spoiler:For example, even the very end where Geralt takes the sword from Olgierd and thereby wounds Olgierd.This moment is purely there to show Olgierd is vulnerable, but it makes no sense at all from Geralt's point of view.A highly experienced Witcher, regarded as an expert in swordsman skills would never take a blade in such a rash way, causing an injury.The 'Blood and Wine' expansion on the other hand was a pure masterpiece!It adds a completely new area, full with new quests, new monsters, new everything.The environment of lively, sunny Toussaint is a huge contrast to the dark, foreboding Velen.This was for me the best endgame DLC I ever played. I'll never look at Fairy Tales in the same way again :DThe GOTY Edition still comes with a few issues, mainly some glitches with NPC's walking half into the ground etc.The controls can be fickle at times especially when trying to jump on/off something or when trying to move down a ladder.In the main game I also had a CTD from time to time (note that I'm using the HD Texture Mod so this could be related).The end verdict is an easy 11/10 for this one, it's a must have for any RPG fan!",No one has rated this review as helpful yet,Recommended
257,Posted: July 23,146.5 hrs on record,"I had a passive interest in the game and series prior to playing Witcher 3 but never made the leap until I played the cross-over event on monster hunter world. The game was on sale at the time and with my interest peaked I finally made the jump, The game is fantastic though having some minor personal annoyances here and there, such as needing to travel to a sign post to fast travel, they are nothing mods cannot fix to personalize your experience and change the game to suit your fancy. The game is otherwise one of the best games i've ever played and dialogue options enable the story to be just a little different each time you play it making repeat playthroughs very worth your while to try different play styles and watch the story pan out in a new way.",No one has rated this review as helpful yet,Recommended
258,Posted: July 23,212.0 hrs on record,"And so, my journey finally ends...   After 200+ hours, which stretched over the course of 4 years, I've finally beat the Witcher 3 (including two expansions).What can I say, it was one hell of a journey.First thing first, this is the type of game that you should play for the plot and characters. While the gameplay is serviceable, I wouldn't say that it's anything extraordinary. In fact, the gameplay is my one and only complain: When the developers first teased the game, they promised that ""you would be able to track down monsters, set traps for them and hunt them down"". To me, this sounded like some gameplay mechanic that you could do by yourself, independently. However, this is not like that. Monster hunting in The Witcher 3 is a process of going from Point A to Point B, using the Witcher Senses (detective mode, whatever), following red tracks to Point C where the monster or quest event is located. So yeah, it's entirely scripted. You don't do anything by yourself, everything is done by following quest markers. This can become repetitive and tedious. The only things that prevent this process from becoming boring are the plot and the characters that are involved in these quests.At first, I was disappointed by the lack of gameplay variety and player freedom (in gameplay at least). However, I started enjoying this game fully when I realized that it's better to take it as an interactive movie, rather then a role-playing game. You are not able to play your own Witcher. Instead, you play as a predefined Witcher with a branching, but predefined, story (and an interesting one at that!).Now, the story and characters are the selling points of this game. They are what keeps you hooked and pushing forward. The writing is clever, funny, and full of interesting situations with no black-and-white outcomes. If you are in any way interested in Dark Fantasy and/or Slavic mythology, you should definitely play this game (if there are still people that haven't done so yet).P.S. I still find the books to be better than the game. Not to give the game a disservice, it's a masterpiece, for sure. However, imagine that the books are EVEN BETTER. Seriously, they're that good. (And I know that the author doesn't like the games, but think of this: Steven King doesn't like Kubrick's ""The Shining"", but that doesn't stop it from being a cult classic, right?).",No one has rated this review as helpful yet,Recommended
259,Posted: July 23,2.4 hrs on record,!.!.!,No one has rated this review as helpful yet,Recommended
260,Posted: July 23,67.6 hrs on record,Just get the damn game.,No one has rated this review as helpful yet,Recommended
261,Posted: July 23,15.5 hrs on record,Best game,No one has rated this review as helpful yet,Recommended
262,Posted: July 23,33.2 hrs on record,amazing,No one has rated this review as helpful yet,Recommended
263,Posted: July 23,3.2 hrs on record,combat is trash,2 people found this review helpful,Not Recommended
264,Posted: July 23,7.3 hrs on record,best game ever,No one has rated this review as helpful yet,Recommended
265,Posted: July 23,106.0 hrs on record,---{Graphics}---[ ] Masterpiece[x] Beautiful[ ] Good[ ] Decent[ ] Will do[ ] Bad[ ] Awful[ ] Paint.exe---{Gameplay}---[ ] Try not to get addicted[x] Very good[ ] Good[ ] Nothing special[ ] Ehh[ ] Bad[ ] Just dont---{Audio}---[x] Eargasm[ ] Very good[ ] Good[ ] Decent[ ] Not too bad[ ] Bad[ ] Earrape---{Ideal Consumer}---[ ] Kids[x] Teens[x] Adults[ ] Everyone[ ] Casual Players[ ] Pro Players---{PC Requirements}---[ ] Check if you can run paint[ ] Potato[ ] Minimum[x] Decent[ ] Fast[ ] Rich boi[ ] Ask NASA if they have a spare computer---{Difficulty}---[ ] Just press a bunch of buttons[ ] Easy[ ] Significant brain usage [ ] Easy to learn / Hard to master[ ] Not so easy[ ] Difficult[x] Dark Souls---{Story}---[ ] Doesnt have/little[ ] Something isnt nothing I guess[ ] Not great[ ] Average[ ] Good[ ] Lovley[x] Will make u cry or smile a lot---{Game Time/Length}---[ ] Long enough for a cup of tea[ ] Short (2-6 hours)[ ] Average (6-12 hours)[ ] Long (12+ hours)[x] Ultimate (100+ hours)---{Price}---[x] Just buy it[ ] Worth the price[ ] Wait for sale (Worth about $10)[ ] Maybe if u have some spare money left[ ] Not recommended[ ] Dont throw money into a trash can---{Bugs}---[ ] Never had any[ ] Minor bugs[x] Few bugs [ ] Can get annoying[ ] Ruining the game[ ] The game itself is a big terrarium for bugsOverall:11/10,No one has rated this review as helpful yet,Recommended
266,Posted: July 23,11.6 hrs on record,"Overrated game made for normies who are bad at games. Can be beaten by a toddler on the hardest difficulty. Combat = lmb spam and dodge spam with the occasional quen cast. There's a reason witcher fanboys never talk about the combat but only about the story and quests lmao.Also way too much pointless dialogue, learn to get to the point. It's like a college kid trying to write an essay by cramming in pointless words.Maybe if there was more gameplay than dialogue and if the gameplay was actually fun.Played like 20 hrs on gog before anyone comments on my 9 hrs.",3 people found this review helpful1 person found this review funny,Not Recommended
267,Posted: July 22,96.0 hrs on record,"Absolute masterpiece of a game, what more can I say. undoubtedly the best game I have played. Currently playing through again for the fourth time, coming back over to PC from PS4.",1 person found this review helpful,Recommended
